{
  "$schema": "https://json-schema.org/draft/2020-12/schema",
  "$id": "comfyui-h3-context://contracts/build_provenance_v1.schema.json",
  "title": "H3 Context build provenance v1",
  "type": "object",
  "additionalProperties": false,
  "required": [
    "schema",
    "builder",
    "build_type",
    "external_parameters",
    "resolved_dependencies",
    "invocation",
    "bundle",
    "embedded_identity"
  ],
  "properties": {
    "schema": { "const": "h3-context-build-provenance/1" },
    "builder": {
      "type": "object",
      "additionalProperties": false,
      "required": ["id"],
      "properties": { "id": { "const": "scripts/frontend_build_report.py" } }
    },
    "build_type": { "const": "h3-context-frontend-offline/1" },
    "external_parameters": {
      "type": "object",
      "additionalProperties": false,
      "required": ["source_commit", "source_tree", "source_inputs_sha256"],
      "properties": {
        "source_commit": { "type": "string", "pattern": "^[0-9a-f]{40}$" },
        "source_tree": { "type": "string", "pattern": "^[0-9a-f]{40}$" },
        "source_inputs_sha256": { "$ref": "#/$defs/digest" }
      }
    },
    "resolved_dependencies": {
      "type": "array",
      "minItems": 1,
      "maxItems": 32,
      "uniqueItems": true,
      "items": {
        "oneOf": [
          {
            "type": "object",
            "additionalProperties": false,
            "required": ["uri", "digest"],
            "properties": {
              "uri": { "type": "string", "minLength": 1, "maxLength": 200 },
              "digest": { "$ref": "#/$defs/digest" }
            }
          },
          {
            "type": "object",
            "additionalProperties": false,
            "required": ["uri", "version"],
            "properties": {
              "uri": { "type": "string", "minLength": 1, "maxLength": 200 },
              "version": { "type": "string", "minLength": 1, "maxLength": 200 }
            }
          }
        ]
      }
    },
    "invocation": {
      "type": "object",
      "additionalProperties": false,
      "required": ["id", "started_on", "finished_on"],
      "properties": {
        "id": { "$ref": "#/$defs/digest" },
        "started_on": { "$ref": "#/$defs/timestamp" },
        "finished_on": { "$ref": "#/$defs/timestamp" }
      }
    },
    "bundle": {
      "type": "object",
      "additionalProperties": false,
      "required": ["path", "sha256", "size"],
      "properties": {
        "path": { "const": "comfyui_h3_context/web/h3-context-sidebar.js" },
        "sha256": { "$ref": "#/$defs/digest" },
        "size": { "type": "integer", "minimum": 1, "maximum": 16777216 }
      }
    },
    "embedded_identity": {
      "type": "object",
      "additionalProperties": false,
      "required": [
        "schema",
        "builder_id",
        "source_commit",
        "source_tree",
        "source_inputs_sha256",
        "resolved_dependencies_sha256"
      ],
      "properties": {
        "schema": { "const": "h3-context-build-identity/1" },
        "builder_id": { "const": "scripts/frontend_build_report.py" },
        "source_commit": { "type": "string", "pattern": "^[0-9a-f]{40}$" },
        "source_tree": { "type": "string", "pattern": "^[0-9a-f]{40}$" },
        "source_inputs_sha256": { "$ref": "#/$defs/digest" },
        "resolved_dependencies_sha256": { "$ref": "#/$defs/digest" }
      }
    }
  },
  "$defs": {
    "digest": { "type": "string", "pattern": "^sha256:[0-9a-f]{64}$" },
    "timestamp": {
      "type": "string",
      "pattern": "^\\d{4}-\\d{2}-\\d{2}T\\d{2}:\\d{2}:\\d{2}Z$"
    }
  }
}
