{
  "build_type": "h3-context-frontend-offline/1",
  "builder": {
    "id": "scripts/frontend_build_report.py"
  },
  "bundle": {
    "path": "comfyui_h3_context/web/h3-context-sidebar.js",
    "sha256": "sha256:fefc67f48395bb9e64ee6cf8c4626e40259f9b2f433a411038b6ed4e238b83c7",
    "size": 1909494
  },
  "embedded_identity": {
    "builder_id": "scripts/frontend_build_report.py",
    "resolved_dependencies_sha256": "sha256:33a348fa45d49b67b366e4dcd3cb7fab5a76c1ad430397d843d71aaa4991e535",
    "schema": "h3-context-build-identity/1",
    "source_commit": "c1fe4093d3d9b2befb76329f2fd77d2fdf4e55e9",
    "source_inputs_sha256": "sha256:9061ac68afb36d70cc107e7faf769e36697f44761dfc86f7c32aaf99ce0ddcaf",
    "source_tree": "0b67dc80be61da56be0bead96e4416e6a297b253"
  },
  "external_parameters": {
    "source_commit": "c1fe4093d3d9b2befb76329f2fd77d2fdf4e55e9",
    "source_inputs_sha256": "sha256:9061ac68afb36d70cc107e7faf769e36697f44761dfc86f7c32aaf99ce0ddcaf",
    "source_tree": "0b67dc80be61da56be0bead96e4416e6a297b253"
  },
  "invocation": {
    "finished_on": "2026-10-13T12:42:44Z",
    "id": "sha256:1886793e2acd0eb2f6e0b3f56b2464e808377b41ca5e7c990ade86e1112b7863",
    "started_on": "2026-10-13T12:42:44Z"
  },
  "resolved_dependencies": [
    {
      "digest": "sha256:94be69f36c4d65a92277c49327bf2c56010d8c3b0087940515f7836c331b2c7e",
      "uri": "contract:h3-context-contract-inventory/1"
    },
    {
      "digest": "sha256:e2ef0f79f3eff5dc071420f17c32d42eb7d9b599f6b27068faed7c910f1fe6cf",
      "uri": "contract:h3-context-public-surface/1"
    },
    {
      "uri": "pkg:pypi/comfyui-frontend-package",
      "version": "1.48.7"
    }
  ],
  "schema": "h3-context-build-provenance/1"
}
